{
  "schema_version": "vllm-cl-publication-candidate-handoff/v1",
  "handoff_id": "publication-candidate-001",
  "producer": {"workflow": "externally-authorized-publication-preparation", "authority_id": "producer-team", "produces_handoff_only": true, "self_approval": false},
  "publication_proposed": true,
  "tested_revision": {
    "repository": "vllm-cl", "base_sha": "0000000000000000000000000000000000000000", "commit_sha": "0000000000000000000000000000000000000000",
    "tree_sha": "0000000000000000000000000000000000000000", "worktree_clean": true,
    "artifact_graph_digest": "sha256:1111111111111111111111111111111111111111111111111111111111111111"
  },
  "publication_candidate": {
    "repository": "vllm-cl", "base_sha": "0000000000000000000000000000000000000000", "commit_sha": "0000000000000000000000000000000000000000",
    "tree_sha": "0000000000000000000000000000000000000000", "worktree_clean": true, "created_at": "2026-08-21T08:00:00Z",
    "included_paths": ["approved.txt"], "excluded_paths": ["excluded.txt"],
    "scoped_diff_digest": "sha256:2222222222222222222222222222222222222222222222222222222222222222",
    "scoped_tree_digest": "sha256:3333333333333333333333333333333333333333333333333333333333333333",
    "patch_equivalence": {"method": "scoped-git-diff-sha256", "tested_scoped_diff_digest": "sha256:4444444444444444444444444444444444444444444444444444444444444444", "candidate_scoped_diff_digest": "sha256:5555555555555555555555555555555555555555555555555555555555555555"},
    "artifact_graph_digest": "sha256:aaaaaaaaaaaaaaaaaaaaaaaaaaaaaaaaaaaaaaaaaaaaaaaaaaaaaaaaaaaaaaaa",
    "rebuilt_artifact_refs": [],
    "affected_gate_refs": [],
    "remote_observation": {"target_base_ref": "refs/heads/main", "target_base_sha": "0000000000000000000000000000000000000000", "pr_tip_ref": "refs/heads/publication", "pr_tip_sha": "0000000000000000000000000000000000000000", "observed_at": "2026-08-21T08:05:00Z"},
    "lease": {"target_base_expected_old_sha": "0000000000000000000000000000000000000000", "pr_tip_expected_old_sha": "0000000000000000000000000000000000000000"},
    "rewrite_required": false,
    "authorization_refs": []
  },
  "generated_at": "2026-08-21T08:05:00Z", "expires_at": "2026-08-22T08:05:00Z", "finalize_action": "none",
  "claim_boundary": "Claim Boundary: this handoff records a candidate for structural assessment only and does not establish authorization or publication, approve, commit, push, rewrite, finalize, or transfer runtime acceptance.",
  "digest": "sha256:bbbbbbbbbbbbbbbbbbbbbbbbbbbbbbbbbbbbbbbbbbbbbbbbbbbbbbbbbbbbbbbb"
}
